{
  "name": "vllm",
  "description": "High-throughput and memory-efficient LLM inference and serving engine.",
  "variables": {
    "VLLM_VERSION": "v0.19.1",
    "VLLM_PORT": "8000",
    "VLLM_MODEL": "mistralai/Mistral-7B-v0.1",
    "GPU_DRIVER": "nvidia",
    "GPU_COUNT": "all"
  },
  "$schema": "https://voidrot.github.io/composable/latest/schemas/fragment.schema.json",
  "env_file": true,
  "env_file_vars": []
}
