{
  "name": "ollama",
  "description": "Get up and running with large language models.",
  "variables": {
    "OLLAMA_VERSION": "latest",
    "OLLAMA_PORT": "11434",
    "OLLAMA_KEEP_ALIVE": "5m",
    "OLLAMA_FLASH_ATTENTION": "1",
    "OLLAMA_KV_CACHE_TYPE": "q8_0"
  },
  "$schema": "https://voidrot.github.io/composable/latest/schemas/fragment.schema.json",
  "env_file": true,
  "env_file_vars": []
}
