{
  "name": "influxdb",
  "description": "InfluxDB time series database",
  "variables": {
    "INFLUXDB_VERSION": "2",
    "INFLUXDB_PORT": "8086",
    "INFLUXDB_ADMIN_USER": "admin",
    "INFLUXDB_ADMIN_PASSWORD": "adminpassword",
    "INFLUXDB_ORG": "myorg",
    "INFLUXDB_BUCKET": "mybucket",
    "INFLUXDB_ADMIN_TOKEN": "mysupersecrettoken"
  },
  "$schema": "https://voidrot.github.io/composable/latest/schemas/fragment.schema.json",
  "env_file": true,
  "env_file_vars": []
}
