{
  "name": "jaeger",
  "description": "Jaeger distributed tracing system (all-in-one)",
  "variables": {
    "JAEGER_VERSION": "latest",
    "JAEGER_UI_PORT": "16686",
    "JAEGER_OTLP_GRPC_PORT": "4317",
    "JAEGER_OTLP_HTTP_PORT": "4318"
  },
  "$schema": "https://voidrot.github.io/composable/latest/schemas/fragment.schema.json",
  "env_file": true,
  "env_file_vars": []
}
