{
  "name": "ollama",
  "description": "Get up and running with large language models.",
  "variables": {
    "OLLAMA_VERSION": "0.21.0",
    "OLLAMA_PORT": "11434",
    "OLLAMA_KEEP_ALIVE": "5m",
    "OLLAMA_FLASH_ATTENTION": "true",
    "OLLAMA_KV_CACHE_TYPE": "q8_0",
    "OLLAMA_MODELS": "/root/.ollama/models",
    "OLLAMA_NUM_PARALLEL": "1",
    "OLLAMA_MAX_VRAM": "0",
    "GPU_DRIVER": "nvidia",
    "GPU_COUNT": "all"
  },
  "$schema": "https://voidrot.github.io/composable/latest/schemas/fragment.schema.json",
  "env_file": true,
  "env_file_vars": []
}
