{
  "name": "influxdb",
  "description": "InfluxDB time series database",
  "variables": {
    "INFLUXDB_VERSION": "2",
    "INFLUXDB_PORT": "8086",
    "INFLUXDB_ADMIN_USER": "admin",
    "INFLUXDB_ADMIN_PASSWORD": "admin123",
    "INFLUXDB_ORG": "my-org",
    "INFLUXDB_BUCKET": "my-bucket",
    "INFLUXDB_ADMIN_TOKEN": "my-super-secret-auth-token"
  },
  "$schema": "https://voidrot.github.io/composable/latest/schemas/fragment.schema.json",
  "env_file": true,
  "env_file_vars": []
}
