{
  "name": "grafana",
  "description": "Grafana observability and visualization platform",
  "variables": {
    "GRAFANA_VERSION": "latest",
    "GRAFANA_PORT": "3000",
    "GRAFANA_ADMIN_PASSWORD": "admin"
  },
  "$schema": "https://voidrot.github.io/composable/latest/schemas/fragment.schema.json",
  "env_file": true,
  "env_file_vars": []
}
