{
  "name": "postgresql",
  "description": "PostgreSQL database service",
  "variables": {
    "POSTGRES_VERSION": "18",
    "POSTGRES_USER": "postgres",
    "POSTGRES_PASSWORD": "postgres",
    "POSTGRES_DB": "postgres",
    "PGDATA": "/var/lib/postgresql/data",
    "POSTGRES_PORT": "5432"
  },
  "$schema": "https://voidrot.github.io/composable/latest/schemas/fragment.schema.json",
  "env_file": true,
  "env_file_vars": []
}
