{
  "name": "chromadb",
  "description": "Open-source AI application database (vector database)",
  "variables": {
    "CHROMA_VERSION": "latest",
    "CHROMA_PORT": "8000",
    "CHROMA_PERSIST_DIRECTORY": "/chroma/chroma",
    "CHROMA_TELEMETRY": "FALSE"
  },
  "$schema": "https://voidrot.github.io/composable/latest/schemas/fragment.schema.json",
  "env_file": true,
  "env_file_vars": []
}
